row,product_name,brand,category,source_large,source_middle,source_small,korean_product_name,english_product_name
91,골반볼륨업 하이웨스트 세미 부츠컷_골반뽕 청바지_연청 / Hip-Boosting High-Waisted Semi-Bootcut Jeans_Hip-Padding Jeans_Light Wash / 여성 / 상의 / 셔츠/블라우스,카인다미 / KINDAME,셔츠/블라우스,여성,상의,셔츠/블라우스,골반볼륨업 하이웨스트 세미 부츠컷_골반뽕 청바지_연청,Hip-Boosting High-Waisted Semi-Bootcut Jeans_Hip-Padding Jeans_Light Wash
92,골반볼륨업 로우웨스트 중진청 세미 부츠컷_골반뽕 청바지 / Hip Volume Up Low-Waist Mid-Dark Blue Semi-Bootcut_Hip-Padding Jeans / 여성 / 바지 / 데님 팬츠,카인다미 / KINDAME,데님 팬츠,여성,바지,데님 팬츠,골반볼륨업 로우웨스트 중진청 세미 부츠컷_골반뽕 청바지,Hip Volume Up Low-Waist Mid-Dark Blue Semi-Bootcut_Hip-Padding Jeans
93,슬림워싱 화이트틴 연중청 부츠컷 / Slim Wash White Teen Light Blue Bootcut / 여성 / 바지 / 데님 팬츠,카인다미 / KINDAME,데님 팬츠,여성,바지,데님 팬츠,슬림워싱 화이트틴 연중청 부츠컷,Slim Wash White Teen Light Blue Bootcut
94,골반볼륨업 슬림워싱 연중청 세미 부츠컷_골반뽕 청바지 / Hip Volume Up Slim Wash Light Blue Semi Bootcut_Hip-Padding Jeans / 여성 / 바지 / 데님 팬츠,카인다미 / KINDAME,데님 팬츠,여성,바지,데님 팬츠,골반볼륨업 슬림워싱 연중청 세미 부츠컷_골반뽕 청바지,Hip Volume Up Slim Wash Light Blue Semi Bootcut_Hip-Padding Jeans
95,제니 트레이닝 스커트 / Jennie training skirt / 여성 / 원피스/스커트 / 미니스커트,카인다미 / KINDAME,미니스커트,여성,원피스/스커트,미니스커트,제니 트레이닝 스커트,Jennie training skirt
96,브이넥 플리츠 원피스 / V-neck pleated dress / 여성 / 원피스/스커트 / 미니원피스,카인다미 / KINDAME,미니원피스,여성,원피스/스커트,미니원피스,브이넥 플리츠 원피스,V-neck pleated dress
97,캡소매 니트 셔츠 원피스 / Cap-sleeve knit shirt dress / 여성 / 원피스/스커트 / 미니원피스,카인다미 / KINDAME,미니원피스,여성,원피스/스커트,미니원피스,캡소매 니트 셔츠 원피스,Cap-sleeve knit shirt dress
98,니트 셔츠 원피스 / knit shirt dress / 여성 / 원피스/스커트 / 미니원피스,카인다미 / KINDAME,미니원피스,여성,원피스/스커트,미니원피스,니트 셔츠 원피스,knit shirt dress
99,플레어 트레이닝 스커트 (숏/롱) / Flare Training Skirt (Short/Long) / 여성 / 원피스/스커트 / 미니스커트,카인다미 / KINDAME,미니스커트,여성,원피스/스커트,미니스커트,플레어 트레이닝 스커트 (숏/롱),Flare Training Skirt (Short/Long)
100,플리츠 트레이닝 스커트 (숏/롱) / Pleated Training Skirt (Short/Long) / 여성 / 원피스/스커트 / 미니스커트,카인다미 / KINDAME,미니스커트,여성,원피스/스커트,미니스커트,플리츠 트레이닝 스커트 (숏/롱),Pleated Training Skirt (Short/Long)
101,에센셜 부츠컷 레깅스 / Essential bootcut leggings / 여성 / 바지 / 트레이닝/조거 팬츠,카인다미 / KINDAME,트레이닝/조거 팬츠,여성,바지,트레이닝/조거 팬츠,에센셜 부츠컷 레깅스,Essential bootcut leggings
102,트랙 골지 후드집업 / Track ribbed zip-up hoodie / 여성 / 아우터 / 후드 집업,카인다미 / KINDAME,후드 집업,여성,아우터,후드 집업,트랙 골지 후드집업,Track ribbed zip-up hoodie
103,데님 벨트 튜브탑 / denim belt tube top / 여성 / 상의 / 민소매 티셔츠,카인다미 / KINDAME,민소매 티셔츠,여성,상의,민소매 티셔츠,데님 벨트 튜브탑,denim belt tube top
104,데님 벨트 스커트 / denim belt skirt / 여성 / 원피스/스커트 / 미니스커트,카인다미 / KINDAME,미니스커트,여성,원피스/스커트,미니스커트,데님 벨트 스커트,denim belt skirt
105,골반볼륨업 로우웨스트 부츠컷_골반뽕청바지(화이트) / Hip Volume Up Low-Waist Bootcut_Hip-Padded Jeans (White) / 여성 / 바지 / 데님 팬츠,카인다미 / KINDAME,데님 팬츠,여성,바지,데님 팬츠,골반볼륨업 로우웨스트 부츠컷_골반뽕청바지(화이트),Hip Volume Up Low-Waist Bootcut_Hip-Padded Jeans (White)
106,골반볼륨업 로우웨스트 부츠컷_골반뽕청바지 (블랙) / Hip Volume Up Low-Waist Bootcut_Hip-Padded Jeans (Black) / 여성 / 바지 / 데님 팬츠,카인다미 / KINDAME,데님 팬츠,여성,바지,데님 팬츠,골반볼륨업 로우웨스트 부츠컷_골반뽕청바지 (블랙),Hip Volume Up Low-Waist Bootcut_Hip-Padded Jeans (Black)
107,데님 버튼 튜브탑 / Denim button tube top / 여성 / 상의 / 민소매 티셔츠,카인다미 / KINDAME,민소매 티셔츠,여성,상의,민소매 티셔츠,데님 버튼 튜브탑,Denim button tube top
108,플리츠 니트 스커트 / Pleated knit skirt / 여성 / 원피스/스커트 / 미니스커트,카인다미 / KINDAME,미니스커트,여성,원피스/스커트,미니스커트,플리츠 니트 스커트,Pleated knit skirt
109,홀터넥 니트 셔츠 / Halterneck knit shirt / 여성 / 상의 / 니트/스웨터,카인다미 / KINDAME,니트/스웨터,여성,상의,니트/스웨터,홀터넥 니트 셔츠,Halterneck knit shirt
110,클래식 플리츠 스커트 (숏/롱) / Classic Pleated Skirt (Short/Long) / 여성 / 원피스/스커트 / 미니스커트,카인다미 / KINDAME,미니스커트,여성,원피스/스커트,미니스커트,클래식 플리츠 스커트 (숏/롱),Classic Pleated Skirt (Short/Long)
111,클래식 H라인 스커트 (숏/롱) / Classic H-line Skirt (Short/Long) / 여성 / 원피스/스커트 / 미니스커트,카인다미 / KINDAME,미니스커트,여성,원피스/스커트,미니스커트,클래식 H라인 스커트 (숏/롱),Classic H-line Skirt (Short/Long)
112,니트 심리스 옆가슴 볼륨업 백리스 브라 / Knit seamless backless bra for side bust volume enhancement / 여성 / 속옷/홈웨어,카인다미 / KINDAME,미분류,여성,속옷/홈웨어,,니트 심리스 옆가슴 볼륨업 백리스 브라,Knit seamless backless bra for side bust volume enhancement
113,케이블 폴딩 니트 스커트 / Cable folding knit skirt / 여성 / 원피스/스커트 / 미니스커트,카인다미 / KINDAME,미니스커트,여성,원피스/스커트,미니스커트,케이블 폴딩 니트 스커트,Cable folding knit skirt
114,기본볼륨 캡내장 레이어드 골지티 / Basic Volume Built-in Cap Layered Ribbed Tee / 여성 / 상의 / 긴소매 티셔츠,카인다미 / KINDAME,긴소매 티셔츠,여성,상의,긴소매 티셔츠,기본볼륨 캡내장 레이어드 골지티,Basic Volume Built-in Cap Layered Ribbed Tee
115,스트랩 니트 블라우스+가디건 세트 / Strap knit blouse + cardigan set / 여성 / 상의 / 셔츠/블라우스,카인다미 / KINDAME,셔츠/블라우스,여성,상의,셔츠/블라우스,스트랩 니트 블라우스+가디건 세트,Strap knit blouse + cardigan set
116,드레이프 버튼 반폴라 / Drape button mock turtleneck / 여성 / 상의 / 긴소매 티셔츠,카인다미 / KINDAME,긴소매 티셔츠,여성,상의,긴소매 티셔츠,드레이프 버튼 반폴라,Drape button mock turtleneck
117,케이블 슬림  니트 가디건 / Cable slim knit cardigan / 여성 / 상의 / 니트/스웨터,카인다미 / KINDAME,니트/스웨터,여성,상의,니트/스웨터,케이블 슬림  니트 가디건,Cable slim knit cardigan
118,멀티 타이 사이드 버튼 티셔츠 / Multi-tie side button T-shirt / 여성 / 상의 / 긴소매 티셔츠,카인다미 / KINDAME,긴소매 티셔츠,여성,상의,긴소매 티셔츠,멀티 타이 사이드 버튼 티셔츠,Multi-tie side button T-shirt
119,프린지 트위드 패딩 코트 / Fringe tweed padded coat / 여성 / 아우터 / 환절기 코트,카인다미 / KINDAME,환절기 코트,여성,아우터,환절기 코트,프린지 트위드 패딩 코트,Fringe tweed padded coat
120,배색 바시티 자켓 / Color-block varsity jacket / 여성 / 아우터 / 숏패딩/헤비 아우터,카인다미 / KINDAME,숏패딩/헤비 아우터,여성,아우터,숏패딩/헤비 아우터,배색 바시티 자켓,Color-block varsity jacket
121,벨벳 리본 코듀로이 플리츠 미니스커트 / Velvet ribbon corduroy pleated mini skirt / 여성 / 원피스/스커트 / 미니스커트,카인다미 / KINDAME,미니스커트,여성,원피스/스커트,미니스커트,벨벳 리본 코듀로이 플리츠 미니스커트,Velvet ribbon corduroy pleated mini skirt
122,벨벳 캉캉 미니스커트 / Velvet tiered miniskirt / 여성 / 원피스/스커트 / 미니스커트,카인다미 / KINDAME,미니스커트,여성,원피스/스커트,미니스커트,벨벳 캉캉 미니스커트,Velvet tiered miniskirt
123,스트라이프 니트 팬츠 / striped knit pants / 여성 / 바지 / 코튼 팬츠,카인다미 / KINDAME,코튼 팬츠,여성,바지,코튼 팬츠,스트라이프 니트 팬츠,striped knit pants
124,투웨이 오프숄더 스트라이프 니트 후드 / Two-way off-shoulder striped knit hoodie / 여성 / 상의 / 니트/스웨터,카인다미 / KINDAME,니트/스웨터,여성,상의,니트/스웨터,투웨이 오프숄더 스트라이프 니트 후드,Two-way off-shoulder striped knit hoodie
125,올인원 골반 볼륨업 코르셋 팬티 / All-in-one hip volume-up corset panties / 여성 / 속옷/홈웨어,카인다미 / KINDAME,미분류,여성,속옷/홈웨어,,올인원 골반 볼륨업 코르셋 팬티,All-in-one hip volume-up corset panties
126,숄더 트임 티 / shoulder cutout top / 여성 / 상의 / 긴소매 티셔츠,카인다미 / KINDAME,긴소매 티셔츠,여성,상의,긴소매 티셔츠,숄더 트임 티,shoulder cutout top
127,폴딩 와이드 니트 팬츠 / Folding wide knit pants / 여성 / 바지 / 코튼 팬츠,카인다미 / KINDAME,코튼 팬츠,여성,바지,코튼 팬츠,폴딩 와이드 니트 팬츠,Folding wide knit pants
128,골반볼륨업 루즈 드레이프 와이드 데님 / Hip-volume-enhancing loose drape wide denim / 여성 / 바지 / 데님 팬츠,카인다미 / KINDAME,데님 팬츠,여성,바지,데님 팬츠,골반볼륨업 루즈 드레이프 와이드 데님,Hip-volume-enhancing loose drape wide denim
129,발레리나 미니 원피스 / ballerina mini dress / 여성 / 원피스/스커트 / 미니원피스,카인다미 / KINDAME,미니원피스,여성,원피스/스커트,미니원피스,발레리나 미니 원피스,ballerina mini dress
130,울 골지 단추 니트 / Wool ribbed button knit / 여성 / 상의 / 니트/스웨터,카인다미 / KINDAME,니트/스웨터,여성,상의,니트/스웨터,울 골지 단추 니트,Wool ribbed button knit
131,퍼 카라 오프숄더 가디건 / Fur collar off-shoulder cardigan / 여성 / 상의 / 셔츠/블라우스,카인다미 / KINDAME,셔츠/블라우스,여성,상의,셔츠/블라우스,퍼 카라 오프숄더 가디건,Fur collar off-shoulder cardigan
132,트위드 니트 가디건 자켓 / Tweed knit cardigan jacket / 여성 / 상의 / 니트/스웨터,카인다미 / KINDAME,니트/스웨터,여성,상의,니트/스웨터,트위드 니트 가디건 자켓,Tweed knit cardigan jacket
133,랩 니트 가디건 / Wrap knit cardigan / 여성 / 상의 / 니트/스웨터,카인다미 / KINDAME,니트/스웨터,여성,상의,니트/스웨터,랩 니트 가디건,Wrap knit cardigan
134,슬림 데님 반팔셔츠 / Slim denim short-sleeve shirt / 여성 / 상의 / 셔츠/블라우스,카인다미 / KINDAME,셔츠/블라우스,여성,상의,셔츠/블라우스,슬림 데님 반팔셔츠,Slim denim short-sleeve shirt
135,슬림핏 자수 나시 / Slim-fit embroidered sleeveless top / 여성 / 상의 / 민소매 티셔츠,카인다미 / KINDAME,민소매 티셔츠,여성,상의,민소매 티셔츠,슬림핏 자수 나시,Slim-fit embroidered sleeveless top
136,기본볼륨 캡내장 버튼 레이어드티 / Basic Volume Built-in Cap Button Layered Tee / 여성 / 상의 / 반소매 티셔츠,카인다미 / KINDAME,반소매 티셔츠,여성,상의,반소매 티셔츠,기본볼륨 캡내장 버튼 레이어드티,Basic Volume Built-in Cap Button Layered Tee
137,여리여리 링배색 반팔티 / Delicate ring color block short-sleeve tee / 여성 / 상의 / 반소매 티셔츠,카인다미 / KINDAME,반소매 티셔츠,여성,상의,반소매 티셔츠,여리여리 링배색 반팔티,Delicate ring color block short-sleeve tee
138,옆가슴 볼륨 스퀘어넥 캡내장 반팔티 / Side bust volume square neck short-sleeve tee with built-in cup / 여성 / 상의 / 반소매 티셔츠,카인다미 / KINDAME,반소매 티셔츠,여성,상의,반소매 티셔츠,옆가슴 볼륨 스퀘어넥 캡내장 반팔티,Side bust volume square neck short-sleeve tee with built-in cup
139,아일렛 셔링 블라우스 / Eyelet Shirred Blouse / 여성 / 상의 / 셔츠/블라우스,카인다미 / KINDAME,셔츠/블라우스,여성,상의,셔츠/블라우스,아일렛 셔링 블라우스,Eyelet Shirred Blouse
140,옆가슴 볼륨 스퀘어넥 캡내장 긴팔티 / Side bust volume square neck long sleeve tee with built-in cup / 여성 / 상의 / 긴소매 티셔츠,카인다미 / KINDAME,긴소매 티셔츠,여성,상의,긴소매 티셔츠,옆가슴 볼륨 스퀘어넥 캡내장 긴팔티,Side bust volume square neck long sleeve tee with built-in cup
141,랩 타이 에센셜 레깅스 / Wrap Tie Essential Leggings / 여성 / 바지 / 트레이닝/조거 팬츠,카인다미 / KINDAME,트레이닝/조거 팬츠,여성,바지,트레이닝/조거 팬츠,랩 타이 에센셜 레깅스,Wrap Tie Essential Leggings
142,아일렛 썸머 니트 가디건 / Eyelet summer knit cardigan / 여성 / 상의 / 니트/스웨터,카인다미 / KINDAME,니트/스웨터,여성,상의,니트/스웨터,아일렛 썸머 니트 가디건,Eyelet summer knit cardigan
143,피그먼트 버뮤다 볼디 팬츠_3 Color / Pigment Bermuda Bold Pants_3 Color / 여성 / 바지 / 숏 팬츠,쏘비 / SEW-B,숏 팬츠,여성,바지,숏 팬츠,피그먼트 버뮤다 볼디 팬츠_3 Color,Pigment Bermuda Bold Pants_3 Color
144,우먼즈 세미크롭 US 1000 White 긴팔티 / Women's Semi-Crop US 1000 White Long Sleeve Tee / 여성 / 상의 / 긴소매 티셔츠,쏘비 / SEW-B,긴소매 티셔츠,여성,상의,긴소매 티셔츠,우먼즈 세미크롭 US 1000 White 긴팔티,Women's Semi-Crop US 1000 White Long Sleeve Tee
145,카모 볼디 벌룬 와이드 트레이닝 롱팬츠 2 Color / Camo Bold Balloon Wide Training Long Pants 2 Colors / 여성 / 바지 / 트레이닝/조거 팬츠,쏘비 / SEW-B,트레이닝/조거 팬츠,여성,바지,트레이닝/조거 팬츠,카모 볼디 벌룬 와이드 트레이닝 롱팬츠 2 Color,Camo Bold Balloon Wide Training Long Pants 2 Colors
146,-9 Do Gray 세미크롭 반팔티 / -9 Do Gray Semi-Crop Short Sleeve Tee / 여성 / 상의 / 반소매 티셔츠,쏘비 / SEW-B,반소매 티셔츠,여성,상의,반소매 티셔츠,-9 Do Gray 세미크롭 반팔티,-9 Do Gray Semi-Crop Short Sleeve Tee
147,KIKI 세미크롭 반팔티 / KIKI Semi-Crop Short Sleeve Tee / 여성 / 상의 / 반소매 티셔츠,쏘비 / SEW-B,반소매 티셔츠,여성,상의,반소매 티셔츠,KIKI 세미크롭 반팔티,KIKI Semi-Crop Short Sleeve Tee
148,BUBBLE BERRY 세미크롭 반팔티 / BUBBLE BERRY Semi-Crop Short Sleeve Tee / 여성 / 상의 / 반소매 티셔츠,쏘비 / SEW-B,반소매 티셔츠,여성,상의,반소매 티셔츠,BUBBLE BERRY 세미크롭 반팔티,BUBBLE BERRY Semi-Crop Short Sleeve Tee
149,SUSU 세미크롭 반팔티 / SUSU Semi-Crop Short Sleeve Tee / 여성 / 상의 / 반소매 티셔츠,쏘비 / SEW-B,반소매 티셔츠,여성,상의,반소매 티셔츠,SUSU 세미크롭 반팔티,SUSU Semi-Crop Short Sleeve Tee
150,Peach neck-베이지 / Peach neck-beige / 여성 / 상의 / 반소매 티셔츠,쏘비 / SEW-B,반소매 티셔츠,여성,상의,반소매 티셔츠,Peach neck-베이지,Peach neck-beige
151,Peach neck-화이트 / Peach neck-white / 여성 / 상의 / 반소매 티셔츠,쏘비 / SEW-B,반소매 티셔츠,여성,상의,반소매 티셔츠,Peach neck-화이트,Peach neck-white
152,Peach neck-핑크 / Peach neck-pink / 여성 / 상의 / 반소매 티셔츠,쏘비 / SEW-B,반소매 티셔츠,여성,상의,반소매 티셔츠,Peach neck-핑크,Peach neck-pink
153,Lov Hood-화이트 / Lov Hood-White / 여성 / 상의 / 반소매 티셔츠,쏘비 / SEW-B,반소매 티셔츠,여성,상의,반소매 티셔츠,Lov Hood-화이트,Lov Hood-White
154,Lov Hood-핑크 / Lov Hood-Pink / 여성 / 상의 / 반소매 티셔츠,쏘비 / SEW-B,반소매 티셔츠,여성,상의,반소매 티셔츠,Lov Hood-핑크,Lov Hood-Pink
155,Lov Hood-블루 / Lov Hood-Blue / 여성 / 상의 / 반소매 티셔츠,쏘비 / SEW-B,반소매 티셔츠,여성,상의,반소매 티셔츠,Lov Hood-블루,Lov Hood-Blue
156,Dot / Dot / 여성 / 상의 / 반소매 티셔츠,쏘비 / SEW-B,반소매 티셔츠,여성,상의,반소매 티셔츠,Dot,Dot
157,Dot / Dot / 여성 / 상의 / 반소매 티셔츠,쏘비 / SEW-B,반소매 티셔츠,여성,상의,반소매 티셔츠,Dot,Dot
158,Tulip -White 세미크롭 / Tulip - White semi-cropped / 여성 / 상의 / 반소매 티셔츠,쏘비 / SEW-B,반소매 티셔츠,여성,상의,반소매 티셔츠,Tulip -White 세미크롭,Tulip - White semi-cropped
159,Fine Flowers / Fine Flowers / 여성 / 상의 / 반소매 티셔츠,쏘비 / SEW-B,반소매 티셔츠,여성,상의,반소매 티셔츠,Fine Flowers,Fine Flowers
160,Twink / Twink / 여성 / 상의 / 반소매 티셔츠,쏘비 / SEW-B,반소매 티셔츠,여성,상의,반소매 티셔츠,Twink,Twink
161,Twink / Twink / 여성 / 상의 / 반소매 티셔츠,쏘비 / SEW-B,반소매 티셔츠,여성,상의,반소매 티셔츠,Twink,Twink
162,카모 버뮤다 볼디 팬츠_2 Color / Camo Bermuda Bold Pants_2 Color / 여성 / 바지 / 숏 팬츠,쏘비 / SEW-B,숏 팬츠,여성,바지,숏 팬츠,카모 버뮤다 볼디 팬츠_2 Color,Camo Bermuda Bold Pants_2 Color
163,세미크롭 레이어드 Roll-Up 반팔티 [민트] / Semi-Crop Layered Roll-Up Short Sleeve Tee [Mint] / 여성 / 상의 / 반소매 티셔츠,쏘비 / SEW-B,반소매 티셔츠,여성,상의,반소매 티셔츠,세미크롭 레이어드 Roll-Up 반팔티 [민트],Semi-Crop Layered Roll-Up Short Sleeve Tee [Mint]
164,세미크롭 레이어드 Roll-Up 반팔티 [핑크] / Semi-Crop Layered Roll-Up Short Sleeve Tee [Pink] / 여성 / 상의 / 반소매 티셔츠,쏘비 / SEW-B,반소매 티셔츠,여성,상의,반소매 티셔츠,세미크롭 레이어드 Roll-Up 반팔티 [핑크],Semi-Crop Layered Roll-Up Short Sleeve Tee [Pink]
165,key 세미크롭 반팔티 / Key semi-cropped short-sleeve tee / 여성 / 상의 / 반소매 티셔츠,쏘비 / SEW-B,반소매 티셔츠,여성,상의,반소매 티셔츠,key 세미크롭 반팔티,Key semi-cropped short-sleeve tee
166,camo text 세미크롭 반팔티 / Camo text semi-cropped short-sleeve tee / 여성 / 상의 / 반소매 티셔츠,쏘비 / SEW-B,반소매 티셔츠,여성,상의,반소매 티셔츠,camo text 세미크롭 반팔티,Camo text semi-cropped short-sleeve tee
167,tiger skin 세미크롭 반팔티 / Tiger Skin Semi-Crop Short Sleeve Tee / 여성 / 상의 / 반소매 티셔츠,쏘비 / SEW-B,반소매 티셔츠,여성,상의,반소매 티셔츠,tiger skin 세미크롭 반팔티,Tiger Skin Semi-Crop Short Sleeve Tee
168,hospital 세미크롭 반팔티 / Hospital semi-cropped short-sleeve tee / 여성 / 상의 / 반소매 티셔츠,쏘비 / SEW-B,반소매 티셔츠,여성,상의,반소매 티셔츠,hospital 세미크롭 반팔티,Hospital semi-cropped short-sleeve tee
169,a24 세미크롭 반팔티 / a24 semi-cropped short-sleeve tee / 여성 / 상의 / 반소매 티셔츠,쏘비 / SEW-B,반소매 티셔츠,여성,상의,반소매 티셔츠,a24 세미크롭 반팔티,a24 semi-cropped short-sleeve tee
170,세미크롭 Green3 긴팔티 / Semi-cropped Green3 long-sleeve tee / 여성 / 상의 / 긴소매 티셔츠,쏘비 / SEW-B,긴소매 티셔츠,여성,상의,긴소매 티셔츠,세미크롭 Green3 긴팔티,Semi-cropped Green3 long-sleeve tee
171,세미크롭 Kyooo 긴팔티 / Semi-cropped Kyooo long-sleeve tee / 여성 / 상의 / 긴소매 티셔츠,쏘비 / SEW-B,긴소매 티셔츠,여성,상의,긴소매 티셔츠,세미크롭 Kyooo 긴팔티,Semi-cropped Kyooo long-sleeve tee
172,세미크롭 SILVERRR 긴팔티 / Semi-cropped SILVERRR long-sleeve tee / 여성 / 상의 / 긴소매 티셔츠,쏘비 / SEW-B,긴소매 티셔츠,여성,상의,긴소매 티셔츠,세미크롭 SILVERRR 긴팔티,Semi-cropped SILVERRR long-sleeve tee
173,세미크롭 ooss 긴팔티 / Semi-cropped OOSS long-sleeve tee / 여성 / 상의 / 긴소매 티셔츠,쏘비 / SEW-B,긴소매 티셔츠,여성,상의,긴소매 티셔츠,세미크롭 ooss 긴팔티,Semi-cropped OOSS long-sleeve tee
174,세미크롭 nain nain 긴팔티 / Semi-cropped nain nain long-sleeve shirt / 여성 / 상의 / 긴소매 티셔츠,쏘비 / SEW-B,긴소매 티셔츠,여성,상의,긴소매 티셔츠,세미크롭 nain nain 긴팔티,Semi-cropped nain nain long-sleeve shirt
175,세미크롭 ey 긴팔티 / Semi-cropped EY long-sleeve tee / 여성 / 상의 / 긴소매 티셔츠,쏘비 / SEW-B,긴소매 티셔츠,여성,상의,긴소매 티셔츠,세미크롭 ey 긴팔티,Semi-cropped EY long-sleeve tee
176,세미크롭 A 긴팔티 / Semi-cropped A-line long-sleeve tee / 여성 / 상의 / 긴소매 티셔츠,쏘비 / SEW-B,긴소매 티셔츠,여성,상의,긴소매 티셔츠,세미크롭 A 긴팔티,Semi-cropped A-line long-sleeve tee
177,세미크롭 Hos93 긴팔티 / Semi-cropped Hos93 long-sleeve tee / 여성 / 상의 / 긴소매 티셔츠,쏘비 / SEW-B,긴소매 티셔츠,여성,상의,긴소매 티셔츠,세미크롭 Hos93 긴팔티,Semi-cropped Hos93 long-sleeve tee
178,세미크롭 sskinn 긴팔티 / Semi-cropped sskinn long-sleeve tee / 여성 / 상의 / 긴소매 티셔츠,쏘비 / SEW-B,긴소매 티셔츠,여성,상의,긴소매 티셔츠,세미크롭 sskinn 긴팔티,Semi-cropped sskinn long-sleeve tee
179,세미크롭 CH 긴팔티 / Semi-cropped CH long-sleeve tee / 여성 / 상의 / 긴소매 티셔츠,쏘비 / SEW-B,긴소매 티셔츠,여성,상의,긴소매 티셔츠,세미크롭 CH 긴팔티,Semi-cropped CH long-sleeve tee
180,세미크롭 four music 긴팔티 / Semi-cropped Four Music long-sleeve shirt / 여성 / 상의 / 긴소매 티셔츠,쏘비 / SEW-B,긴소매 티셔츠,여성,상의,긴소매 티셔츠,세미크롭 four music 긴팔티,Semi-cropped Four Music long-sleeve shirt
181,세미크롭 gp 긴팔티 / Semi-cropped GP long-sleeve tee / 여성 / 상의 / 긴소매 티셔츠,쏘비 / SEW-B,긴소매 티셔츠,여성,상의,긴소매 티셔츠,세미크롭 gp 긴팔티,Semi-cropped GP long-sleeve tee
182,세미크롭 spider 긴팔티 / Semi-cropped spider long-sleeve shirt / 여성 / 상의 / 긴소매 티셔츠,쏘비 / SEW-B,긴소매 티셔츠,여성,상의,긴소매 티셔츠,세미크롭 spider 긴팔티,Semi-cropped spider long-sleeve shirt
183,세미크롭 hoof 긴팔티 / Semi-cropped hoof long-sleeve shirt / 여성 / 상의 / 긴소매 티셔츠,쏘비 / SEW-B,긴소매 티셔츠,여성,상의,긴소매 티셔츠,세미크롭 hoof 긴팔티,Semi-cropped hoof long-sleeve shirt
184,세미크롭 ging 긴팔티 / Semi-cropped ging long-sleeve tee / 여성 / 상의 / 긴소매 티셔츠,쏘비 / SEW-B,긴소매 티셔츠,여성,상의,긴소매 티셔츠,세미크롭 ging 긴팔티,Semi-cropped ging long-sleeve tee
185,캥거루 보카시 후드티 (세미크롭) 베이지 / Kangaroo Heather Hoodie (Semi-Crop) Beige / 여성 / 상의 / 후드 티셔츠,쏘비 / SEW-B,후드 티셔츠,여성,상의,후드 티셔츠,캥거루 보카시 후드티 (세미크롭) 베이지,Kangaroo Heather Hoodie (Semi-Crop) Beige
186,세미크롭 Red Band 긴팔티 / Semi-cropped Red Band long-sleeve tee / 여성 / 상의 / 긴소매 티셔츠,쏘비 / SEW-B,긴소매 티셔츠,여성,상의,긴소매 티셔츠,세미크롭 Red Band 긴팔티,Semi-cropped Red Band long-sleeve tee
187,세미크롭 bump post 긴팔티 / Semi-cropped bump post long-sleeve shirt / 여성 / 상의 / 긴소매 티셔츠,쏘비 / SEW-B,긴소매 티셔츠,여성,상의,긴소매 티셔츠,세미크롭 bump post 긴팔티,Semi-cropped bump post long-sleeve shirt
188,바라클라바 후드티 (세미크롭) 딥 / Balaclava Hoodie (Semi-Crop) Deep / 여성 / 상의 / 후드 티셔츠,쏘비 / SEW-B,후드 티셔츠,여성,상의,후드 티셔츠,바라클라바 후드티 (세미크롭) 딥,Balaclava Hoodie (Semi-Crop) Deep
189,하이넥 white camo (세미오버) 후드집업 / High-neck white camo (semi-oversized) zip-up hoodie / 여성 / 아우터 / 후드 집업,쏘비 / SEW-B,후드 집업,여성,아우터,후드 집업,하이넥 white camo (세미오버) 후드집업,High-neck white camo (semi-oversized) zip-up hoodie
190,하이넥 black camo (세미오버) 후드집업 / High-neck black camo (semi-oversized) zip-up hoodie / 여성 / 아우터 / 후드 집업,쏘비 / SEW-B,후드 집업,여성,아우터,후드 집업,하이넥 black camo (세미오버) 후드집업,High-neck black camo (semi-oversized) zip-up hoodie
191,세미크롭 bluestar2 긴팔티 / Semi-cropped bluestar2 long-sleeve shirt / 여성 / 상의 / 긴소매 티셔츠,쏘비 / SEW-B,긴소매 티셔츠,여성,상의,긴소매 티셔츠,세미크롭 bluestar2 긴팔티,Semi-cropped bluestar2 long-sleeve shirt
