row,product_name,brand,category,source_large,source_middle,source_small,korean_product_name,english_product_name
192,세미크롭 달마시안 보트넥 [샌드 옐로우] / Semi-cropped Dalmatian boat neck [Sand Yellow] / 여성 / 상의 / 긴소매 티셔츠,쏘비 / SEW-B,긴소매 티셔츠,여성,상의,긴소매 티셔츠,세미크롭 달마시안 보트넥 [샌드 옐로우],Semi-cropped Dalmatian boat neck [Sand Yellow]
193,세미크롭 달마시안 보트넥 [오트 베이지] / Semi-cropped Dalmatian Boat Neck [Oat Beige] / 여성 / 상의 / 긴소매 티셔츠,쏘비 / SEW-B,긴소매 티셔츠,여성,상의,긴소매 티셔츠,세미크롭 달마시안 보트넥 [오트 베이지],Semi-cropped Dalmatian Boat Neck [Oat Beige]
194,세미크롭 달마시안 보트넥 [밀키 화이트] / Semi-cropped Dalmatian Boat Neck [Milky White] / 여성 / 상의 / 긴소매 티셔츠,쏘비 / SEW-B,긴소매 티셔츠,여성,상의,긴소매 티셔츠,세미크롭 달마시안 보트넥 [밀키 화이트],Semi-cropped Dalmatian Boat Neck [Milky White]
195,post 세미크롭 반팔티 [네이비] / post Semi-cropped short-sleeve tee [Navy] / 여성 / 상의 / 반소매 티셔츠,쏘비 / SEW-B,반소매 티셔츠,여성,상의,반소매 티셔츠,post 세미크롭 반팔티 [네이비],post Semi-cropped short-sleeve tee [Navy]
196,post 세미크롭 반팔티 [화이트] / post Semi-cropped short-sleeve tee [White] / 여성 / 상의 / 반소매 티셔츠,쏘비 / SEW-B,반소매 티셔츠,여성,상의,반소매 티셔츠,post 세미크롭 반팔티 [화이트],post Semi-cropped short-sleeve tee [White]
197,post 세미크롭 반팔티 [차콜] / post Semi-cropped short-sleeve t-shirt [Charcoal] / 여성 / 상의 / 반소매 티셔츠,쏘비 / SEW-B,반소매 티셔츠,여성,상의,반소매 티셔츠,post 세미크롭 반팔티 [차콜],post Semi-cropped short-sleeve t-shirt [Charcoal]
198,post 세미크롭 반팔티 [그레이 멜란지] / post Semi-cropped short-sleeve tee [Gray Melange] / 여성 / 상의 / 반소매 티셔츠,쏘비 / SEW-B,반소매 티셔츠,여성,상의,반소매 티셔츠,post 세미크롭 반팔티 [그레이 멜란지],post Semi-cropped short-sleeve tee [Gray Melange]
199,gree 세미크롭 반팔티 [네이비] / Gree Semi-Crop Short Sleeve Tee [Navy] / 여성 / 상의 / 반소매 티셔츠,쏘비 / SEW-B,반소매 티셔츠,여성,상의,반소매 티셔츠,gree 세미크롭 반팔티 [네이비],Gree Semi-Crop Short Sleeve Tee [Navy]
200,4our eye 세미크롭 반팔티 [화이트] / 4our eye Semi-cropped short sleeve tee [White] / 여성 / 상의 / 반소매 티셔츠,쏘비 / SEW-B,반소매 티셔츠,여성,상의,반소매 티셔츠,4our eye 세미크롭 반팔티 [화이트],4our eye Semi-cropped short sleeve tee [White]
201,4our eye 세미크롭 반팔티 [차콜] / 4our eye Semi-cropped short sleeve tee [Charcoal] / 여성 / 상의 / 반소매 티셔츠,쏘비 / SEW-B,반소매 티셔츠,여성,상의,반소매 티셔츠,4our eye 세미크롭 반팔티 [차콜],4our eye Semi-cropped short sleeve tee [Charcoal]
202,4our eye 세미크롭 반팔티 [그레이 멜란지] / 4our eye Semi-cropped short sleeve tee [Gray Melange] / 여성 / 상의 / 반소매 티셔츠,쏘비 / SEW-B,반소매 티셔츠,여성,상의,반소매 티셔츠,4our eye 세미크롭 반팔티 [그레이 멜란지],4our eye Semi-cropped short sleeve tee [Gray Melange]
203,bold 세미크롭 반팔티 [그레이 멜란지] / Bold Semi-Crop Short Sleeve Tee [Gray Melange] / 여성 / 상의 / 반소매 티셔츠,쏘비 / SEW-B,반소매 티셔츠,여성,상의,반소매 티셔츠,bold 세미크롭 반팔티 [그레이 멜란지],Bold Semi-Crop Short Sleeve Tee [Gray Melange]
204,oran! 세미크롭 반팔티 [네이비] / oran! Semi-cropped short-sleeve tee [Navy] / 여성 / 상의 / 반소매 티셔츠,쏘비 / SEW-B,반소매 티셔츠,여성,상의,반소매 티셔츠,oran! 세미크롭 반팔티 [네이비],oran! Semi-cropped short-sleeve tee [Navy]
205,meteor 세미크롭 반팔티 [네이비] / Meteor Semi-Crop Short Sleeve T-shirt [Navy] / 여성 / 상의 / 반소매 티셔츠,쏘비 / SEW-B,반소매 티셔츠,여성,상의,반소매 티셔츠,meteor 세미크롭 반팔티 [네이비],Meteor Semi-Crop Short Sleeve T-shirt [Navy]
206,meteor 세미크롭 반팔티 [차콜] / Meteor Semi-Crop Short Sleeve T-shirt [Charcoal] / 여성 / 상의 / 반소매 티셔츠,쏘비 / SEW-B,반소매 티셔츠,여성,상의,반소매 티셔츠,meteor 세미크롭 반팔티 [차콜],Meteor Semi-Crop Short Sleeve T-shirt [Charcoal]
207,meteor 세미크롭 반팔티 [그레이 멜란지] / Meteor Semi-Crop Short Sleeve Tee [Gray Melange] / 여성 / 상의 / 반소매 티셔츠,쏘비 / SEW-B,반소매 티셔츠,여성,상의,반소매 티셔츠,meteor 세미크롭 반팔티 [그레이 멜란지],Meteor Semi-Crop Short Sleeve Tee [Gray Melange]
208,oneeye 세미크롭 반팔티 [네이비] / oneeye Semi-Crop Short Sleeve T-shirt [Navy] / 여성 / 상의 / 반소매 티셔츠,쏘비 / SEW-B,반소매 티셔츠,여성,상의,반소매 티셔츠,oneeye 세미크롭 반팔티 [네이비],oneeye Semi-Crop Short Sleeve T-shirt [Navy]
209,oneeye 세미크롭 반팔티 [화이트] / oneeye semi-cropped short-sleeve tee [White] / 여성 / 상의 / 반소매 티셔츠,쏘비 / SEW-B,반소매 티셔츠,여성,상의,반소매 티셔츠,oneeye 세미크롭 반팔티 [화이트],oneeye semi-cropped short-sleeve tee [White]
210,oneeye 세미크롭 반팔티 [차콜] / oneeye semi-cropped short sleeve tee [Charcoal] / 여성 / 상의 / 반소매 티셔츠,쏘비 / SEW-B,반소매 티셔츠,여성,상의,반소매 티셔츠,oneeye 세미크롭 반팔티 [차콜],oneeye semi-cropped short sleeve tee [Charcoal]
211,oneeye 세미크롭 반팔티 [그레이 멜란지] / oneeye Semi-Crop Short Sleeve Tee [Gray Melange] / 여성 / 상의 / 반소매 티셔츠,쏘비 / SEW-B,반소매 티셔츠,여성,상의,반소매 티셔츠,oneeye 세미크롭 반팔티 [그레이 멜란지],oneeye Semi-Crop Short Sleeve Tee [Gray Melange]
212,do blue 세미크롭 반팔티 [네이비] / do blue semi-cropped short-sleeve tee [Navy] / 여성 / 상의 / 반소매 티셔츠,쏘비 / SEW-B,반소매 티셔츠,여성,상의,반소매 티셔츠,do blue 세미크롭 반팔티 [네이비],do blue semi-cropped short-sleeve tee [Navy]
213,ago 세미크롭 반팔티 [네이비] / ago Semi-cropped short-sleeve tee [Navy] / 여성 / 상의 / 반소매 티셔츠,쏘비 / SEW-B,반소매 티셔츠,여성,상의,반소매 티셔츠,ago 세미크롭 반팔티 [네이비],ago Semi-cropped short-sleeve tee [Navy]
214,ago 세미크롭 반팔티 [화이트] / ago Semi-cropped short-sleeve tee [White] / 여성 / 상의 / 반소매 티셔츠,쏘비 / SEW-B,반소매 티셔츠,여성,상의,반소매 티셔츠,ago 세미크롭 반팔티 [화이트],ago Semi-cropped short-sleeve tee [White]
215,ago 세미크롭 반팔티 [차콜] / ago Semi-cropped short-sleeve tee [Charcoal] / 여성 / 상의 / 반소매 티셔츠,쏘비 / SEW-B,반소매 티셔츠,여성,상의,반소매 티셔츠,ago 세미크롭 반팔티 [차콜],ago Semi-cropped short-sleeve tee [Charcoal]
216,ago 세미크롭 반팔티 [그레이 멜란지] / ago Semi-cropped short-sleeve tee [Gray Melange] / 여성 / 상의 / 반소매 티셔츠,쏘비 / SEW-B,반소매 티셔츠,여성,상의,반소매 티셔츠,ago 세미크롭 반팔티 [그레이 멜란지],ago Semi-cropped short-sleeve tee [Gray Melange]
217,what so 세미크롭 반팔티 [네이비] / What So Semi-Crop Short Sleeve T-shirt [Navy] / 여성 / 상의 / 반소매 티셔츠,쏘비 / SEW-B,반소매 티셔츠,여성,상의,반소매 티셔츠,what so 세미크롭 반팔티 [네이비],What So Semi-Crop Short Sleeve T-shirt [Navy]
218,what so 세미크롭 반팔티 [화이트] / What So Semi-Crop Short Sleeve T-shirt [White] / 여성 / 상의 / 반소매 티셔츠,쏘비 / SEW-B,반소매 티셔츠,여성,상의,반소매 티셔츠,what so 세미크롭 반팔티 [화이트],What So Semi-Crop Short Sleeve T-shirt [White]
219,what so 세미크롭 반팔티 [차콜] / What So Semi-Crop Short Sleeve T-shirt [Charcoal] / 여성 / 상의 / 반소매 티셔츠,쏘비 / SEW-B,반소매 티셔츠,여성,상의,반소매 티셔츠,what so 세미크롭 반팔티 [차콜],What So Semi-Crop Short Sleeve T-shirt [Charcoal]
220,what so 세미크롭 반팔티 [그레이 멜란지] / What So Semi-Crop Short Sleeve Tee [Gray Melange] / 여성 / 상의 / 반소매 티셔츠,쏘비 / SEW-B,반소매 티셔츠,여성,상의,반소매 티셔츠,what so 세미크롭 반팔티 [그레이 멜란지],What So Semi-Crop Short Sleeve Tee [Gray Melange]
221,소프트 세미크롭 카라티 [그레이프 레드] / Soft Semi-Crop Polo Shirt [Grape Red] / 여성 / 상의 / 반소매 티셔츠,쏘비 / SEW-B,반소매 티셔츠,여성,상의,반소매 티셔츠,소프트 세미크롭 카라티 [그레이프 레드],Soft Semi-Crop Polo Shirt [Grape Red]
222,소프트 세미크롭 카라티 [아사이 블루] / Soft Semi-Crop Polo Shirt [Acai Blue] / 여성 / 상의 / 반소매 티셔츠,쏘비 / SEW-B,반소매 티셔츠,여성,상의,반소매 티셔츠,소프트 세미크롭 카라티 [아사이 블루],Soft Semi-Crop Polo Shirt [Acai Blue]
223,소프트 세미크롭 카라티 [아보카도 그린] / Soft Semi-Crop Polo Shirt [Avocado Green] / 여성 / 상의 / 반소매 티셔츠,쏘비 / SEW-B,반소매 티셔츠,여성,상의,반소매 티셔츠,소프트 세미크롭 카라티 [아보카도 그린],Soft Semi-Crop Polo Shirt [Avocado Green]
224,소프트 세미크롭 카라티 [솔트 그레이] / Soft Semi-Crop Polo Shirt [Salt Grey] / 여성 / 상의 / 반소매 티셔츠,쏘비 / SEW-B,반소매 티셔츠,여성,상의,반소매 티셔츠,소프트 세미크롭 카라티 [솔트 그레이],Soft Semi-Crop Polo Shirt [Salt Grey]
225,스무디 세미크롭 T [민트 소르베] / Smoothie Semi-Crop T [Mint Sorbet] / 여성 / 상의 / 반소매 티셔츠,쏘비 / SEW-B,반소매 티셔츠,여성,상의,반소매 티셔츠,스무디 세미크롭 T [민트 소르베],Smoothie Semi-Crop T [Mint Sorbet]
226,스무디 세미크롭 T [그레이 파우더] / Smoothie Semi-Crop T [Gray Powder] / 여성 / 상의 / 반소매 티셔츠,쏘비 / SEW-B,반소매 티셔츠,여성,상의,반소매 티셔츠,스무디 세미크롭 T [그레이 파우더],Smoothie Semi-Crop T [Gray Powder]
227,스무디 세미크롭 T [올리브 셔벗] / Smoothie Semi-Crop T [Olive Sherbet] / 여성 / 상의 / 반소매 티셔츠,쏘비 / SEW-B,반소매 티셔츠,여성,상의,반소매 티셔츠,스무디 세미크롭 T [올리브 셔벗],Smoothie Semi-Crop T [Olive Sherbet]
228,세미크롭 반팔니트 [시나몬 브라운] / Semi-cropped short-sleeve knit [Cinnamon Brown] / 여성 / 상의 / 반소매 티셔츠,쏘비 / SEW-B,반소매 티셔츠,여성,상의,반소매 티셔츠,세미크롭 반팔니트 [시나몬 브라운],Semi-cropped short-sleeve knit [Cinnamon Brown]
229,세미크롭 반팔니트 [포레스트 그린] / Semi-cropped short-sleeve knit [Forest Green] / 여성 / 상의 / 반소매 티셔츠,쏘비 / SEW-B,반소매 티셔츠,여성,상의,반소매 티셔츠,세미크롭 반팔니트 [포레스트 그린],Semi-cropped short-sleeve knit [Forest Green]
230,세미크롭 반팔니트 [토마토 레드] / Semi-cropped short-sleeve knit [Tomato Red] / 여성 / 상의 / 반소매 티셔츠,쏘비 / SEW-B,반소매 티셔츠,여성,상의,반소매 티셔츠,세미크롭 반팔니트 [토마토 레드],Semi-cropped short-sleeve knit [Tomato Red]
231,스티치 커브드 롱팬츠 [화이트 멜란지] / Stitched Curved Long Pants [White Melange] / 여성 / 바지 / 트레이닝/조거 팬츠,쏘비 / SEW-B,트레이닝/조거 팬츠,여성,바지,트레이닝/조거 팬츠,스티치 커브드 롱팬츠 [화이트 멜란지],Stitched Curved Long Pants [White Melange]
232,스티치 커브드 롱팬츠 [그린] / Stitched Curved Long Pants [Green] / 여성 / 바지 / 트레이닝/조거 팬츠,쏘비 / SEW-B,트레이닝/조거 팬츠,여성,바지,트레이닝/조거 팬츠,스티치 커브드 롱팬츠 [그린],Stitched Curved Long Pants [Green]
233,스티치 커브드 롱팬츠 [네이비] / Stitch Curved Long Pants [Navy] / 여성 / 바지 / 트레이닝/조거 팬츠,쏘비 / SEW-B,트레이닝/조거 팬츠,여성,바지,트레이닝/조거 팬츠,스티치 커브드 롱팬츠 [네이비],Stitch Curved Long Pants [Navy]
234,빈티지 오너먼트 (세미크롭) 아이보리 / Vintage Ornament (Semi-Crop) Ivory / 여성 / 아우터 / 후드 집업,쏘비 / SEW-B,후드 집업,여성,아우터,후드 집업,빈티지 오너먼트 (세미크롭) 아이보리,Vintage Ornament (Semi-Crop) Ivory
235,3.4 세미크롭 반팔티 [네이비] / 3.4 Semi-cropped short-sleeve tee [Navy] / 여성 / 상의 / 반소매 티셔츠,쏘비 / SEW-B,반소매 티셔츠,여성,상의,반소매 티셔츠,3.4 세미크롭 반팔티 [네이비],3.4 Semi-cropped short-sleeve tee [Navy]
236,3.4 세미크롭 반팔티 [화이트] / 3.4 Semi-cropped short-sleeve tee [White] / 여성 / 상의 / 반소매 티셔츠,쏘비 / SEW-B,반소매 티셔츠,여성,상의,반소매 티셔츠,3.4 세미크롭 반팔티 [화이트],3.4 Semi-cropped short-sleeve tee [White]
237,3.4 세미크롭 반팔티 [차콜] / 3.4 Semi-Crop Short Sleeve T-shirt [Charcoal] / 여성 / 상의 / 반소매 티셔츠,쏘비 / SEW-B,반소매 티셔츠,여성,상의,반소매 티셔츠,3.4 세미크롭 반팔티 [차콜],3.4 Semi-Crop Short Sleeve T-shirt [Charcoal]
238,3.4 세미크롭 반팔티 [그레이 멜란지] / 3.4 Semi-Crop Short Sleeve Tee [Gray Melange] / 여성 / 상의 / 반소매 티셔츠,쏘비 / SEW-B,반소매 티셔츠,여성,상의,반소매 티셔츠,3.4 세미크롭 반팔티 [그레이 멜란지],3.4 Semi-Crop Short Sleeve Tee [Gray Melange]
239,moss 세미크롭 반팔티 [화이트] / Moss Semi-Crop Short Sleeve Tee [White] / 여성 / 상의 / 반소매 티셔츠,쏘비 / SEW-B,반소매 티셔츠,여성,상의,반소매 티셔츠,moss 세미크롭 반팔티 [화이트],Moss Semi-Crop Short Sleeve Tee [White]
240,moss 세미크롭 반팔티 [그레이 멜란지] / Moss Semi-Crop Short Sleeve Tee [Gray Melange] / 여성 / 상의 / 반소매 티셔츠,쏘비 / SEW-B,반소매 티셔츠,여성,상의,반소매 티셔츠,moss 세미크롭 반팔티 [그레이 멜란지],Moss Semi-Crop Short Sleeve Tee [Gray Melange]
241,stst 세미크롭 반팔티 [네이비] / stst Semi-Crop Short Sleeve T-shirt [Navy] / 여성 / 상의 / 반소매 티셔츠,쏘비 / SEW-B,반소매 티셔츠,여성,상의,반소매 티셔츠,stst 세미크롭 반팔티 [네이비],stst Semi-Crop Short Sleeve T-shirt [Navy]
242,stst 세미크롭 반팔티 [화이트] / stst Semi-Crop Short Sleeve T-shirt [White] / 여성 / 상의 / 반소매 티셔츠,쏘비 / SEW-B,반소매 티셔츠,여성,상의,반소매 티셔츠,stst 세미크롭 반팔티 [화이트],stst Semi-Crop Short Sleeve T-shirt [White]
243,stst 세미크롭 반팔티 [차콜] / stst Semi-Crop Short Sleeve T-shirt [Charcoal] / 여성 / 상의 / 반소매 티셔츠,쏘비 / SEW-B,반소매 티셔츠,여성,상의,반소매 티셔츠,stst 세미크롭 반팔티 [차콜],stst Semi-Crop Short Sleeve T-shirt [Charcoal]
244,stst 세미크롭 반팔티 [그레이 멜란지] / stst Semi-Crop Short Sleeve Tee [Gray Melange] / 여성 / 상의 / 반소매 티셔츠,쏘비 / SEW-B,반소매 티셔츠,여성,상의,반소매 티셔츠,stst 세미크롭 반팔티 [그레이 멜란지],stst Semi-Crop Short Sleeve Tee [Gray Melange]
245,WALK 오버핏 반팔티 / WALK Oversized Short Sleeve Tee / 여성 / 상의 / 반소매 티셔츠,쏘비 / SEW-B,반소매 티셔츠,여성,상의,반소매 티셔츠,WALK 오버핏 반팔티,WALK Oversized Short Sleeve Tee
246,JUJU 오버핏 반팔티 / JUJU Oversized Short Sleeve Tee / 여성 / 상의 / 반소매 티셔츠,쏘비 / SEW-B,반소매 티셔츠,여성,상의,반소매 티셔츠,JUJU 오버핏 반팔티,JUJU Oversized Short Sleeve Tee
247,jump! 오버핏 반팔티 / Jump! Oversized Short Sleeve Tee / 여성 / 상의 / 반소매 티셔츠,쏘비 / SEW-B,반소매 티셔츠,여성,상의,반소매 티셔츠,jump! 오버핏 반팔티,Jump! Oversized Short Sleeve Tee
248,NWWW 오버핏 반팔티 / NWWW Oversized Short Sleeve Tee / 여성 / 상의 / 반소매 티셔츠,쏘비 / SEW-B,반소매 티셔츠,여성,상의,반소매 티셔츠,NWWW 오버핏 반팔티,NWWW Oversized Short Sleeve Tee
249,BUMPING 오버핏 반팔티 / BUMPING Oversized Short Sleeve Tee / 여성 / 상의 / 반소매 티셔츠,쏘비 / SEW-B,반소매 티셔츠,여성,상의,반소매 티셔츠,BUMPING 오버핏 반팔티,BUMPING Oversized Short Sleeve Tee
250,uu 세미크롭 반팔티 [그레이 멜란지] / uu Semi-cropped short-sleeve tee [Gray Melange] / 여성 / 상의 / 반소매 티셔츠,쏘비 / SEW-B,반소매 티셔츠,여성,상의,반소매 티셔츠,uu 세미크롭 반팔티 [그레이 멜란지],uu Semi-cropped short-sleeve tee [Gray Melange]
251,uu 세미크롭 반팔티 [화이트] / uu Semi-cropped short-sleeve tee [White] / 여성 / 상의 / 반소매 티셔츠,쏘비 / SEW-B,반소매 티셔츠,여성,상의,반소매 티셔츠,uu 세미크롭 반팔티 [화이트],uu Semi-cropped short-sleeve tee [White]
252,necksss 세미크롭 반팔티 [화이트] / necksss semi-cropped short sleeve tee [White] / 여성 / 상의 / 반소매 티셔츠,쏘비 / SEW-B,반소매 티셔츠,여성,상의,반소매 티셔츠,necksss 세미크롭 반팔티 [화이트],necksss semi-cropped short sleeve tee [White]
253,necksss 세미크롭 반팔티 [그레이 멜란지] / necksss semi-cropped short sleeve tee [Gray Melange] / 여성 / 상의 / 반소매 티셔츠,쏘비 / SEW-B,반소매 티셔츠,여성,상의,반소매 티셔츠,necksss 세미크롭 반팔티 [그레이 멜란지],necksss semi-cropped short sleeve tee [Gray Melange]
254,b3 세미크롭 반팔티 [그레이 멜란지] / b3 Semi-cropped short-sleeve tee [Gray Melange] / 여성 / 상의 / 반소매 티셔츠,쏘비 / SEW-B,반소매 티셔츠,여성,상의,반소매 티셔츠,b3 세미크롭 반팔티 [그레이 멜란지],b3 Semi-cropped short-sleeve tee [Gray Melange]
255,b3 세미크롭 반팔티 [화이트] / b3 Semi-cropped short-sleeve tee [White] / 여성 / 상의 / 반소매 티셔츠,쏘비 / SEW-B,반소매 티셔츠,여성,상의,반소매 티셔츠,b3 세미크롭 반팔티 [화이트],b3 Semi-cropped short-sleeve tee [White]
256,tour 세미크롭 반팔티 [화이트] / tour semi-cropped short sleeve t-shirt [White] / 여성 / 상의 / 반소매 티셔츠,쏘비 / SEW-B,반소매 티셔츠,여성,상의,반소매 티셔츠,tour 세미크롭 반팔티 [화이트],tour semi-cropped short sleeve t-shirt [White]
257,버튼 새깅 버뮤다 팬츠 [데님 블랙] / Button-sagging Bermuda Pants [Denim Black] / 여성 / 바지 / 숏 팬츠,쏘비 / SEW-B,숏 팬츠,여성,바지,숏 팬츠,버튼 새깅 버뮤다 팬츠 [데님 블랙],Button-sagging Bermuda Pants [Denim Black]
258,Baby stp 세미크롭 반팔티 [베이지] / Baby stp Semi-cropped Short Sleeve Tee [Beige] / 여성 / 상의 / 반소매 티셔츠,쏘비 / SEW-B,반소매 티셔츠,여성,상의,반소매 티셔츠,Baby stp 세미크롭 반팔티 [베이지],Baby stp Semi-cropped Short Sleeve Tee [Beige]
259,Baby stp 세미크롭 반팔티 [핑크] / Baby stp Semi-cropped Short Sleeve T-shirt [Pink] / 여성 / 상의 / 반소매 티셔츠,쏘비 / SEW-B,반소매 티셔츠,여성,상의,반소매 티셔츠,Baby stp 세미크롭 반팔티 [핑크],Baby stp Semi-cropped Short Sleeve T-shirt [Pink]
260,Baby stp 세미크롭 반팔티 [화이트] / Baby stp Semi-cropped Short Sleeve T-shirt [White] / 여성 / 상의 / 반소매 티셔츠,쏘비 / SEW-B,반소매 티셔츠,여성,상의,반소매 티셔츠,Baby stp 세미크롭 반팔티 [화이트],Baby stp Semi-cropped Short Sleeve T-shirt [White]
261,Baby stp 세미크롭 반팔티 [블루] / Baby stp Semi-cropped Short Sleeve T-shirt [Blue] / 여성 / 상의 / 반소매 티셔츠,쏘비 / SEW-B,반소매 티셔츠,여성,상의,반소매 티셔츠,Baby stp 세미크롭 반팔티 [블루],Baby stp Semi-cropped Short Sleeve T-shirt [Blue]
262,KEY! 오버핏 반팔티 / KEY! Oversized short-sleeve tee / 여성 / 상의 / 반소매 티셔츠,쏘비 / SEW-B,반소매 티셔츠,여성,상의,반소매 티셔츠,KEY! 오버핏 반팔티,KEY! Oversized short-sleeve tee
263,SNAIL 오버핏 반팔티 / SNAIL Oversized Short Sleeve Tee / 여성 / 상의 / 반소매 티셔츠,쏘비 / SEW-B,반소매 티셔츠,여성,상의,반소매 티셔츠,SNAIL 오버핏 반팔티,SNAIL Oversized Short Sleeve Tee
264,2 TEETH 오버핏 반팔티 / 2 TEETH Oversized Short Sleeve Tee / 여성 / 상의 / 반소매 티셔츠,쏘비 / SEW-B,반소매 티셔츠,여성,상의,반소매 티셔츠,2 TEETH 오버핏 반팔티,2 TEETH Oversized Short Sleeve Tee
265,BOHEMIAN 오버핏 반팔티 / BOHEMIAN Oversized Short Sleeve Tee / 여성 / 상의 / 반소매 티셔츠,쏘비 / SEW-B,반소매 티셔츠,여성,상의,반소매 티셔츠,BOHEMIAN 오버핏 반팔티,BOHEMIAN Oversized Short Sleeve Tee
266,[× ILLIT] BRYN VELCRO SNEAKERS V2 / [× ILLIT] BRYN VELCRO SNEAKERS V2 / 여성 / 신발 / 구두,락피쉬웨더웨어 / ROCKFISH WEATHERWEAR,구두,여성,신발,구두,[× ILLIT] BRYN VELCRO SNEAKERS V2,[× ILLIT] BRYN VELCRO SNEAKERS V2
267,크로스라인 슬림 탑 화이트 / Crossline Slim Top White / 여성 / 상의 / 긴소매 티셔츠,러프넥 / ROUGHNECK,긴소매 티셔츠,여성,상의,긴소매 티셔츠,크로스라인 슬림 탑 화이트,Crossline Slim Top White
268,튜튜 팬츠 스커트 블랙 / Black tutu pants skirt / 여성 / 원피스/스커트 / 미니스커트,러프넥 / ROUGHNECK,미니스커트,여성,원피스/스커트,미니스커트,튜튜 팬츠 스커트 블랙,Black tutu pants skirt
269,버드 헤드 토크 / Bird Head Torque / 남성 / 소품 / 모자,아크테릭스 / ARCTERYX,모자,남성,소품,모자,버드 헤드 토크,Bird Head Torque
270,맨티스 26 백팩 / Mantis 26 Backpack / 남성 / 스포츠/레저 / 가방,아크테릭스 / ARCTERYX,가방,남성,스포츠/레저,가방,맨티스 26 백팩,Mantis 26 Backpack
271,맨티스 16 백팩 / Mantis 16 Backpack / 남성 / 스포츠/레저 / 가방,아크테릭스 / ARCTERYX,가방,남성,스포츠/레저,가방,맨티스 16 백팩,Mantis 16 Backpack
272,Lettering Sweat Shirt (gray) / Lettering Sweatshirt (gray) / 여성 / 상의 / 맨투맨/스웨트,카키포인트 / KHAKIPOINT,맨투맨/스웨트,여성,상의,맨투맨/스웨트,Lettering Sweat Shirt (gray),Lettering Sweatshirt (gray)
273,Steel Button Top (sage) / Steel Button Top (sage) / 여성 / 상의 / 긴소매 티셔츠,카키포인트 / KHAKIPOINT,긴소매 티셔츠,여성,상의,긴소매 티셔츠,Steel Button Top (sage),Steel Button Top (sage)
274,Lettering Sweat Shorts (gray) / Lettering Sweat Shorts (gray) / 여성 / 바지 / 숏 팬츠,카키포인트 / KHAKIPOINT,숏 팬츠,여성,바지,숏 팬츠,Lettering Sweat Shorts (gray),Lettering Sweat Shorts (gray)
275,Steel Button Top (black) / Steel Button Top (black) / 여성 / 상의 / 긴소매 티셔츠,카키포인트 / KHAKIPOINT,긴소매 티셔츠,여성,상의,긴소매 티셔츠,Steel Button Top (black),Steel Button Top (black)
276,Steel Button Top (light gray) / Steel Button Top (light gray) / 여성 / 상의 / 긴소매 티셔츠,카키포인트 / KHAKIPOINT,긴소매 티셔츠,여성,상의,긴소매 티셔츠,Steel Button Top (light gray),Steel Button Top (light gray)
277,Sheer V-neck Top (white) / Sheer V-neck Top (white) / 여성 / 상의 / 긴소매 티셔츠,카키포인트 / KHAKIPOINT,긴소매 티셔츠,여성,상의,긴소매 티셔츠,Sheer V-neck Top (white),Sheer V-neck Top (white)
278,Sheer V-neck Top (black) / Sheer V-neck Top (black) / 여성 / 상의 / 긴소매 티셔츠,카키포인트 / KHAKIPOINT,긴소매 티셔츠,여성,상의,긴소매 티셔츠,Sheer V-neck Top (black),Sheer V-neck Top (black)
279,Muted Core Sleeveless (white) / Muted Core Sleeveless (white) / 여성 / 상의 / 민소매 티셔츠,카키포인트 / KHAKIPOINT,민소매 티셔츠,여성,상의,민소매 티셔츠,Muted Core Sleeveless (white),Muted Core Sleeveless (white)
280,Muted Core Sleeveless (black) / Muted Core Sleeveless (black) / 여성 / 상의 / 민소매 티셔츠,카키포인트 / KHAKIPOINT,민소매 티셔츠,여성,상의,민소매 티셔츠,Muted Core Sleeveless (black),Muted Core Sleeveless (black)
281,Muted Core Sleeveless (charcoal) / Muted Core Sleeveless (charcoal) / 여성 / 상의 / 민소매 티셔츠,카키포인트 / KHAKIPOINT,민소매 티셔츠,여성,상의,민소매 티셔츠,Muted Core Sleeveless (charcoal),Muted Core Sleeveless (charcoal)
282,Muted Core Sleeveless (beige) / Muted Core Sleeveless (beige) / 여성 / 상의 / 민소매 티셔츠,카키포인트 / KHAKIPOINT,민소매 티셔츠,여성,상의,민소매 티셔츠,Muted Core Sleeveless (beige),Muted Core Sleeveless (beige)
283,Double Stud Belt (white) / Double Stud Belt (white) / 여성 / 소품 / 벨트,카키포인트 / KHAKIPOINT,벨트,여성,소품,벨트,Double Stud Belt (white),Double Stud Belt (white)
284,Double Stud Belt (black) / Double Stud Belt (black) / 여성 / 소품 / 벨트,카키포인트 / KHAKIPOINT,벨트,여성,소품,벨트,Double Stud Belt (black),Double Stud Belt (black)
285,Unbalanced Midi Skirt (brown) / Unbalanced Midi Skirt (brown) / 여성 / 원피스/스커트 / 미디스커트,카키포인트 / KHAKIPOINT,미디스커트,여성,원피스/스커트,미디스커트,Unbalanced Midi Skirt (brown),Unbalanced Midi Skirt (brown)
